{
  "version": 1,
  "title": "Bộ nguyên tắc tuân thủ lô đất",
  "updated": "2026-10-25",
  "outcomes": ["phu-hop", "chua-phu-hop", "chua-du-du-lieu"],
  "principle": "Chỉ kết luận phù hợp khi một nguyên tắc áp dụng và đủ dữ liệu. Thiếu mã, thiếu hình hoặc chưa có nguyên tắc cho chức năng cấp trên thì kết luận chưa đủ dữ liệu.",
  "hierarchy": [
    { "id": "QHC10", "label": "QHC 1/10.000", "directChild": "QHPK" },
    { "id": "QHPK", "label": "QHPK 1/2.000", "directChild": "QHCT" },
    { "id": "QHCT", "label": "QHCT 1/500", "directChild": null }
  ],
  "categories": {
    "cay-xanh-cong-cong": {
      "label": "Đất cây xanh công cộng",
      "also": ["cay-xanh"],
      "landCodes": [5],
      "patternKeys": ["C-CXDT"],
      "phrases": [
        "cây xanh sử dụng công cộng",
        "cây xanh công cộng",
        "cây xanh công viên",
        "đất cây xanh sử dụng công cộng đô thị"
      ],
      "sources": [
        "public/js/qhc2045.js LAND_CODES[5]: khóa C-CXDT, nhãn «Đất cây xanh sử dụng công cộng đô thị».",
        "rules/tuan-thu-cap-do/rules.json codebooks.landUse.groups.cx-cong-cong: mã 5.",
        "public/js/tt16Symbols.js khóa C-CXDT (Mục 02 QHC). Không lấy khóa 1-CV: khóa đó là cây xanh nói chung ở QHPK/QHCT."
      ]
    },
    "cay-xanh": {
      "label": "Cây xanh",
      "landCodes": [15, 16, 33],
      "patternKeys": ["1-CV", "CX-HC", "CX-CD", "C-CXHC", "C-CXCD"],
      "phrases": [
        "cây xanh sử dụng hạn chế",
        "cây xanh chuyên dụng",
        "cây xanh thể dục",
        "cây xanh",
        "công viên"
      ],
      "sources": [
        "LAND_CODES 15 C-CXHC, 16 C-CXCD, 33 «Đất cây xanh thể dục thể thao».",
        "TT16: 1-CV cây xanh sử dụng công cộng (Mục 04), CX-HC, CX-CD, C-CXHC, C-CXCD.",
        "Mã 5 không ghi ở đây: nhóm cây xanh công cộng kéo theo nhóm này qua also."
      ]
    },
    "bai-do-xe": {
      "label": "Bãi đỗ xe",
      "landCodes": [],
      "patternKeys": ["2-BDX"],
      "phrases": ["bãi đỗ xe", "bãi xe"],
      "sources": [
        "TT16 khóa 2-BDX, nhãn «Đất bãi đỗ xe», layer DAT_HTKT_Baidoxe.",
        "QHC 1/10.000 chưa có mã LAND_CODES cho bãi đỗ xe; không bịa mã số."
      ]
    },
    "ha-tang": {
      "label": "Công trình hạ tầng",
      "landCodes": [6, 21],
      "patternKeys": ["HTK", "C-HTDT", "C-HTNG"],
      "phrases": ["hạ tầng kỹ thuật", "công trình hạ tầng"],
      "sources": [
        "LAND_CODES 6 C-HTDT, 21 C-HTNG.",
        "TT16 khóa HTK «Hạ tầng kỹ thuật khác». Không gồm GT (giao thông) và không gồm 2-BDX."
      ]
    },
    "dich-vu": {
      "label": "Dịch vụ",
      "landCodes": [10, 12],
      "patternKeys": ["9-TM", "DL"],
      "phrases": ["thương mại dịch vụ", "dịch vụ du lịch", "khu dịch vụ", "đất dịch vụ"],
      "sources": [
        "LAND_CODES 10 khóa 9-TM «Đất thương mại dịch vụ»; 12 khóa C-DL «Đất dịch vụ, du lịch».",
        "TT16: 9-TM «Khu dịch vụ (chợ, TTTM)», DL «Khu dịch vụ du lịch».",
        "Không gồm mã 2 (dịch vụ - công cộng đô thị) và không gồm O-HH (hỗn hợp nhà ở và dịch vụ)."
      ]
    }
  },
  "rules": [
    {
      "id": "CXCC-01",
      "title": "Đất cây xanh công cộng ở QHC 1/10.000",
      "anchor": { "level": "QHC10", "category": "cay-xanh-cong-cong" },
      "steps": [
        {
          "childLevel": "QHPK",
          "directParent": "QHC10",
          "allow": ["cay-xanh", "bai-do-xe"]
        },
        {
          "childLevel": "QHCT",
          "directParent": "QHPK",
          "allow": ["cay-xanh", "bai-do-xe", "ha-tang"],
          "areaShare": {
            "category": "dich-vu",
            "maxRatio": 0.05,
            "basis": "phan-thua-trong-vung-neo"
          }
        }
      ],
      "note": "QHPK nằm trong ô QHC mã 5 chỉ được xếp cây xanh hoặc bãi đỗ xe. QHCT chỉ xét khi có lô QHPK cha và ô QHC tại đó vẫn là cây xanh công cộng: thêm công trình hạ tầng; dịch vụ không quá 5% phần giao giữa phạm vi đang xem và vùng cây xanh công cộng."
    }
  ]
}
